{
  "id": "local-summary-pipeline",
  "url": "https://example.com/articles/local-summary-pipeline",
  "title": "記事要約をローカル処理として分離する設計",
  "source": "Zenn",
  "genre": "AI活用",
  "technologies": ["LLM", "Local-first", "Git"],
  "reading_minutes": 7,
  "created_at": "2026-08-06",
  "updated_at": "2026-08-10",
  "summary": [
    "記事本文の取得とLLMによる要約をローカル処理に分離し、公開サイトには生成済みのデータだけを配置する設計です。実行コストや秘密情報を配信環境から切り離せます。",
    "要約結果を人が確認してからGitへ追加するため、誤った内容が自動公開されるリスクも抑えられます。再生成やモデル変更を履歴として残す方法も扱います。",
    "公開テンプレートは特定のLLMへ依存せず、利用者が好きな手段で作った要約を同じJSONスキーマへ保存します。"
  ],
  "ogp": { "title": "要約処理の分離", "description": "sourceからLLM、resultからrepositoryへ" }
}
