{
  "id": "forkable-archive",
  "url": "https://example.com/articles/forkable-archive",
  "title": "フォークして使える記事管理サイトの作り方",
  "source": "Zenn",
  "genre": "アーキテクチャ",
  "technologies": ["OSS", "GitHub", "Cloudflare"],
  "reading_minutes": 13,
  "created_at": "2026-08-01",
  "updated_at": "2026-08-05",
  "summary": [
    "共通コードとサンプルデータだけを公開リポジトリに置き、利用者が自分の記事データと設定を差し替えて使える構成を説明しています。",
    "GitHub ActionsからCloudflare Workersへデプロイする流れ、秘密情報をコミットしない設定、上流テンプレートの更新を取り込む方法までを一通り確認できます。",
    "フォーク固有のCloudflareアカウント、API Token、非公開記事を上流へ戻さない境界をREADMEとファイル構成の両方で示します。"
  ],
  "ogp": { "title": "公開テンプレート", "description": "fork、edit、push、deploy" }
}
