{
  "id": "static-json-search",
  "url": "https://example.com/articles/static-json-search",
  "title": "静的JSONで実現する高速な記事検索",
  "source": "Qiita",
  "genre": "検索",
  "technologies": ["JSON", "Search", "TypeScript"],
  "reading_minutes": 9,
  "created_at": "2026-08-05",
  "updated_at": "2026-08-09",
  "summary": [
    "タイトル、要約、ジャンル、技術タグ、作成日を正規化したJSONから、ブラウザ上で複合検索する方法を紹介しています。小規模な記事集なら外部検索サービスを使わずに高速な絞り込みができます。",
    "日本語の表記揺れ、複数条件のAND検索、日付範囲、読了時間の扱いを例に、検索条件と表示件数を同期させる実装を確認できます。",
    "検索処理を純粋関数に分けることで、DOMやWorkersランタイムに依存しない単体テストが可能になります。"
  ],
  "ogp": { "title": "検索索引を作る", "description": "articlesをnormalizeしindexへ変換" }
}
