{
  "id": "fractal-engineering",
  "url": "https://torus-engineering.uhyo.workers.dev/ja/fractal/",
  "title": "フラクタルエンジニアリング — Fractal Engineering",
  "source": "Torus Engineering",
  "genre": "AI駆動開発",
  "technologies": [
    "AIエージェント",
    "サブエージェント",
    "推論時計算"
  ],
  "reading_minutes": 7,
  "created_at": "2026-09-26",
  "updated_at": "2026-09-26",
  "summary": [
    "記事は、トーラスエンジニアリングの次に整数次元を増やすのではなく、非整数次元を持つフラクタルへ進むという設定で、AIエージェントが子エージェントへ仕事を無限に委譲する開発手法を描きます。これはAI駆動開発コミュニティで次々に生まれるバズワードや万能論を風刺する作品であり、無限委譲が実際に可能だと実証する技術解説ではありません。",
    "各階層のエージェントは、仕事の受領、分解、子への委譲、結果の検証、親への報告という同じ契約を持ちます。記事はこれを自己相似な余帰納的モデルとして表し、`children: () => Fractal[]` によって必要になった時だけ子を実体化すると説明しますが、フラクタル次元 D ≈ 1.585 は戯画的な推奨値として提示されています。",
    "計算資源については、深さ n の階層へ r^n（0 < r < 1）の予算を割り当てれば、総量が等比級数 Σr^n = 1/(1-r) に収まるという『ゼノン予算』を持ち出します。無限階層でも有限予算に収まるという主張は、この数学的比喩に基づくジョークであり、実運用で保証されたコストモデルではありません。",
    "品質保証では、レビュー作用が収縮的なら一意の不動点 v∞ が存在し、それを『完成』と呼びます。これとは別に、各レビューが欠陥密度を一定割合 q < 1 へ縮めると仮定して q^n → 0 からバグゼロを唱えますが、いずれも置いた前提から導く思考実験であり、現実のソフトウェア品質を証明するものではありません。",
    "成果物はKoch雪片のように、有限段階では近似しか見えず、極限で初めて『端のない詳細』が現れるものとして描かれます。ただし実際に生成・転送するのは観測した部分だけとされ、Fig. 1 はその第4近似を示して、無限の構造と有限の観測結果を対比します。",
    "Hilbertホテルの部屋番号を一つずつずらせば満室でも新しい客を受け入れられる話を、無限バックログへ緊急タスクを割り込ませる方法になぞらえます。終わりのない作業列にも再配置によって新しい仕事を入れられるという、無限集合の性質を使った戯画です。",
    "無限の生成空間はバベルの図書館に例えられます。あらゆる成果物が生成可能になるなら、開発の価値は候補を作ることから、検証によって正解を特定することへ移ると論じます。",
    "記事は無限階層の実質を推論時計算として整理します。トーラスエンジニアリングが時間方向に実行を改善で巻くのに対し、フラクタルエンジニアリングは深さ方向に委譲と検証を積み重ねるという対比で、同じ計算資源の使い方に異なる物語を与えています。",
    "FAQでは 1 + 2 + 3 + ... = -1/12 を持ち出して見積もりを『-1/12人日』とするなど、数学上の概念を組織設計へ強引に接続します。末尾の説明や各所のオマージュも含め、数学・組織論・AIエージェント論の誇張を意図的に重ねたユーモアであることが示されています。"
  ],
  "ogp": {
    "image_url": "https://torus-engineering.uhyo.workers.dev/og/fractal.png",
    "title": "フラクタルエンジニアリング — Fractal Engineering",
    "description": "分割せよ、そして分割させよ。無限の組織から、無限の成果を。"
  }
}
