{
  "id": "github-actions-ci-acceleration",
  "url": "https://tech.timee.co.jp/entry/2026/06/12/120143",
  "title": "【GitHub Actions】明日からマネできる CI 高速化テクニック 3 選",
  "source": "Timee Product Team Blog",
  "genre": "CI/CD",
  "technologies": [
    "GitHub Actions",
    "AWS S3",
    "OIDC",
    "Ruby on Rails",
    "MySQL",
    "Docker Compose"
  ],
  "reading_minutes": 16,
  "created_at": "2026-08-17",
  "updated_at": "2026-08-17",
  "summary": [
    "タイミーのRailsバックエンドで運用するGitHub Actionsのテストパイプラインを題材に、CIの待ち時間を減らすための3施策を紹介しています。対象は、依存パッケージのキャッシュ保存先、データベースセットアップ、CI用MySQLの書き込み設定です。",
    "1つ目の課題は、数百MBから1GB超になるvendor/bundleをactions/cacheで保存・復元すると、突発的に数分かかることでした。AWS上のセルフホストランナーからAzure Blob Storage上のバックエンドへインターネット経由でアクセスする構成では約20MB/sまで落ちる事例があり、リポジトリ当たり10GBと7日間未使用時の自動削除という制約もありました。",
    "解決策として、actions/cache互換のruns-on/cacheへ差し替え、ランナーと同じ東京リージョンのS3バケットをバックエンドにしました。RUNS_ON_S3_BUCKET_CACHEを設定するだけで既存のキャッシュ操作を移行でき、記事では200MiB/s以上、単純計算で約10倍のスループット改善が示されています。",
    "vendor/bundleのキャッシュキーは、OS・Rubyバージョン・Gemfile.lockのハッシュによる完全一致から、Rubyバージョン一致、OS一致へ段階的にフォールバックします。完全一致がなくても近いキャッシュから差分のgemだけを導入でき、S3へのアクセスは長期アクセスキーを保存せずOIDC認証で行います。",
    "2つ目の課題は、マイグレーションが数百件を超えた環境ではrails db:create db:schema:loadにも数分かかり、並列テストジョブごとに同じセットアップ時間が発生することでした。そこで、マイグレーション済みMySQLのデータディレクトリを丸ごと再利用する方針へ切り替えています。",
    "masterブランチでdb/migrateやdb/schema.rbなどが変わったとき、または毎日UTC 2時に専用ワークフローを実行し、MySQLを起動してrails db:create db:migrateを完了させた./tmp/mysql_dataをS3へ保存します。featureブランチ側はこのデータを復元して/var/lib/mysqlへマウントし、準備済みのデータベースとして起動します。",
    "MySQLデータのキャッシュキーにはOS、CPUアーキテクチャ、MySQLバージョン、ランナー環境、db/schema.rbのハッシュを含めます。スキーマ変更時の更新だけでなく、バイナリ非互換になり得る実行条件の違いもキャッシュ分離へ反映する設計です。",
    "復元処理はComposite Actionへ切り出し、RSpecだけでなくSteepなどのワークフローでも再利用します。キャッシュヒット時はブランチ固有の差分だけrails db:migrateで適用し、ミス時はrails db:create db:schema:loadへフォールバックすることで、通常のDBセットアップを数分から数秒へ短縮しました。",
    "3つ目の課題は、テストごとのBEGIN・ROLLBACKやテーブルのクリーンアップに対し、本番向けのMySQL既定設定がコミットごとのfsyncなどを行い、CIでは書き込みI/Oのボトルネックになっていたことです。使い捨てのテストデータでは耐久性より速度を優先できると判断しています。",
    "CI専用のcompose.ci.ymlでは、innodb-flush-log-at-trx-commit=0でログ書き込みとfsyncを毎秒のバッチにし、sync-binlog=0でバイナリログ同期をOSへ委ね、skip-innodb-doublewriteでページの二重書き込みを無効化します。これにより、コミットごとの同期処理と不要な書き込みI/Oを削減します。",
    "これらのMySQL設定は、クラッシュ時に最大1秒分のトランザクションが失われる、バイナリログが不完全になる、部分書き込みでデータが破損するという危険を伴います。記事は、テスト後にデータを捨てるCI環境だけで許容し、本番環境には適用しないよう明確に注意しています。",
    "記事は、CI高速化に万能な近道はなく、ボトルネックを一つずつ取り除くことが重要だとまとめています。ネットワーク的に近いS3へキャッシュを置く、毎回不要なマイグレーションを再利用する、使い捨てDBでは不要な耐久性を外すという、用途に応じた割り切りが大きな短縮につながっています。"
  ],
  "ogp": {
    "image_url": "https://ogimage.blog.st-hatena.com/26006613497622710/14945776032041484973/1781233303",
    "title": "【GitHub Actions】明日からマネできる CI 高速化テクニック 3 選  - Timee Product Team Blog",
    "description": "はじめに こんにちは、タイミーでエンジニアをしている徳富(@yannKazu1)です。 タイミーではメインサービスのバックエンドを Rails で開発しています（Go を採用しているプロダクトもありますが、本記事では Rails を前提とします）。 突然ですが、皆さんのチームでは CI の待ち時間、気になっていませんか？ 「Push した、コーヒー淹れた、戻ってきた、まだ回ってる……」みたいな経験は、開発者なら一度はあるのではないでしょうか。 本記事では、そんな状況を改善するために GitHub Actions 上のテスト実行パイプラインで取り組んだ 3 つの高速化テク を紹介します。どれも「…"
  }
}
