{
  "id": "grok-bot-ai-coworker",
  "url": "https://www.datacamp.com/ja/blog/grok-bot",
  "title": "Grok Bot：SpaceXAIの新しいAI同僚が示すエージェント競争の行方",
  "source": "DataCamp",
  "genre": "AIエージェント",
  "technologies": [
    "Grok Bot",
    "AIエージェント",
    "Computer Use",
    "ChatGPT Work",
    "Claude Cowork",
    "Gemini Spark"
  ],
  "reading_minutes": 13,
  "created_at": "2026-08-29",
  "updated_at": "2026-08-29",
  "summary": [
    "Grok Botは、SpaceXAIが2026年8月11日にベータ公開した常時稼働型のAIエージェント製品です。通常のGrokチャットボットとは別製品で、アカウントに割り当てられたクラウドコンピュータ上の名前付きBotへ役割と成果を委任し、端末を閉じた後も作業を続けさせます。",
    "一般的な対話型AIが質問への回答を返し、その後の操作を人に委ねるのに対し、Grok BotはアプリやWebサイトを横断して作業し、完成した成果物または判断が必要な質問を持ち帰ります。会話をまたいで役割や嗜好を保持しますが、記憶を正しい情報源とみなさず、重要事項は最新データで確認させる必要があります。",
    "リリース時点ではSuperGrok Heavy、Cursor Ultra、Cursor Teams Premiumの加入者向けで、macOS、Windows、iOS 18以降のiPhoneに対応します。Linux、Android、iPadは未対応で、企業向け利用はウェイトリストとなっており、アクセス条件は限定的な有料ベータです。",
    "BotはAPIや専用コネクタだけに依存せず、人と同様に共有クラウドコンピュータのブラウザやアプリへログインして操作します。これにより、APIのないダッシュボードやレガシーWebアプリも対象にできますが、社内デモと同等の信頼性が実環境でも得られるかはまだ検証途上です。",
    "Grok Botは万能な1体ではなく、複数の専門Botからなる名簿として設計されています。Bot同士は直接メッセージを送り、グループ内でタスクの所有権を引き継げるため、調整役のBotが受信箱、採用、経費、バグ対応などの専門Botへ仕事を委任するチーム型運用を想定しています。",
    "同一アカウントの全Botは、ファイル、ブラウザセッション、ログイン情報を含む1台のコンピュータを共有します。Botごとの分離はセキュリティ境界にならないため、機密性の異なるクライアント業務などを安全に分離したい場合は、Botではなくアカウント自体を分ける必要があります。",
    "利用者が一度作業する様子を最大10分間、音声なしで録画すると、Botがその手順を確認・テスト可能なスキルの下書きへ変換します。スキルは作業方法を表し、ルーチンは特定のBotへの割り当てと実行スケジュールを表すため、まず実タスクでスキルを検証し、信頼できてから定期実行へ進む順序が推奨されます。",
    "公開事例には、見込み顧客の調査と営業文面の下書き、Salesforceへの問い合わせ、航空便の自動チェックイン、製品UI上のバグ再現からチケット起票と修正担当Botへの引き継ぎがあります。ただし、これらはSpaceXAI社内の報告や関係者の投稿を中心とする事例で、独立した検証結果ではありません。",
    "記事はGrok Botを、ChatGPT Work、Claude Cowork、Gemini Sparkと同じ市場変化の中に位置づけています。4製品の設計や接続方式は異なるものの、競争の軸は質問へ最も上手に答えるモデルから、複数工程の仕事を任せ、ユーザーが席を外しても成果まで進められるシステムへ移りつつあります。",
    "初期ベータが今後証明すべき点として、長く複雑なワークフローでの信頼性、広い権限を与えるための信頼と制御、監査ビューやBot専用支出上限が未提供というガバナンス上の不足、Bot間の受け渡しによって誤りが連鎖する危険が挙げられています。",
    "パスワード、二要素認証コード、CAPTCHAはBotへ渡すのではなく、必要な工程だけ利用者が操作を引き継ぐ設計です。メール、CRM、財務情報などを接続する前には、どの操作に事前承認が必要かを設定し、Botが利用できる権限と機微情報の範囲を確認する必要があります。",
    "記事の結論は、AIエージェントの重心が支援から成果の所有へ移り、将来のインターフェースが単独のチャットではなく専門Botのチームになる可能性を示します。最終的な勝者を決めるのはモデルのベンチマークだけではなく、重要な仕事を逐一監視せず任せられるほど、コンピュータ操作、記憶、権限管理を含むシステム全体が信頼されるかどうかです。"
  ]
}
