{
  "id": "conceptual-design-code-fate",
  "url": "https://zenn.dev/takeshi_teshima/articles/bae79b2f0f97be",
  "title": "概念設計が、その後のコードの命運を左右する",
  "source": "Zenn",
  "genre": "ソフトウェア設計",
  "technologies": [
    "概念設計",
    "ドメイン駆動設計",
    "モデリング"
  ],
  "reading_minutes": 26,
  "created_at": "2026-08-16",
  "updated_at": "2026-08-16",
  "summary": [
    "記事のいう概念設計は、所与の要件をクラスやUMLへ落とす手前で、現実をどの概念として認識するかを決める作業です。現実に別々に存在するものを正確に切り分けることで、その後の通常ケース、例外、変更のしやすさ、発生し得るバグまで決まると主張します。",
    "題材のECサイトでは、Orderが購入内容だけでなく配送状況も持っています。商品が配送中に破損して交換品を送る要望が来ると、注文数量を増やす、0円の注文を作るなど、売買の事実を配送上の都合で書き換える不自然な対応が必要になります。",
    "0円の交換注文は、配送だけを見れば処理できても、売上集計、購入履歴、推薦、返品、監視などへ混入します。各所に『これは本物の購入か』という例外条件や申し送りが必要になり、クーポンによる正当な0円購入まで除外する危険も生まれます。",
    "別の設計では、顧客が何をいくついくらで買ったかをOrder、その約束のうち何をいくつ届けるかをFulfillmentとして分けます。破損時は失敗したFulfillmentを残し、新しいFulfillmentを追加するだけで、売買の事実を変えずに再配送を表せます。",
    "OrderとFulfillmentを分けておくと、後から求められた分割発送も、一件のOrderに複数のFulfillmentを結び付けるだけで表現できます。『分割発送モード』やpartiallyShippedのような専用フラグを増やさず、既存概念の自然な組み合わせで対応できます。",
    "これは未来の仕様を予測して先回りした結果ではありません。人が将来考える自然な仕様は現実についてのメンタルモデルから生まれるため、コードの概念が現実の認識と合っていれば、未提示の仕様も既存モデルへ自然に収まりやすいと説明します。",
    "適切な概念分離は、バグを注意深く防ぐだけでなく、誤った状態の存在余地を減らします。Orderの集計はそのまま購入数量を、Fulfillmentの集計は履行数量を表し、交換品が購入データへ入り込まないため、後続の実装者全員に例外知識を要求しません。",
    "定まった概念は、新機能を検討する『概念テスト』にも使えます。画面・API・DBの話へ直行せず、誰が何に対して何をする機能かを既存概念の言葉で表し、それぞれにとって本来できて自然な責務かを確かめます。",
    "電子書籍の並べ替えでは、Book自身が棚での表示順を持つより、BookshelfがBookを並べる、またはBookshelf上にPlacementがあると表す方が自然です。どの概念へ状態を置くべきかという違和感は、コードを書く前にプロダクトデザイナーも検出できます。",
    "新機能を概念の文章で説明できれば、実装理由も長期に残ります。後から当時の企画書や議論を知らない人でも、『Bookが順番を持つ』のではなく『BookshelfがBookを並べる』という構造から、機能の意図を復元できます。",
    "概念境界を見つける一つ目の手掛かりは、関係者・部署・コンポーネントごとの視点です。注文受付が扱う『何をいくらで買ったか』と、物流が扱う『何をまだ届けるか』のように、別の主体が別の理由・時点で変更するものは、異なる概念である可能性があります。",
    "二つ目の手掛かりは、対象を忠実に表す固有の名前です。営業の『受注』、倉庫の『出荷』、サポートの『再送』という語彙差は、同じレコードの状態違いではなく、関係者が別の対象を認識している兆候になり、DDDのドメイン言語は概念発見のセンサーとして働きます。",
    "命名はラベル付けにとどまらず、何を持たせてよいかという境界も決めます。Fulfillmentと名付けた概念へ顧客の支払額を置くのは不自然だと名前自体が知らせるため、『まあ通じる』ではなく、それしかない名前を探すことが設計上重要です。",
    "概念設計はKISSやYAGNIと矛盾しません。目先のコード量だけを最小化して現実を不自然に表すと例外処理が長期に波及するため、まず現実を無理なく表す概念を置き、その境界内で必要機能に対する最も単純な実装を選ぶのが順序です。",
    "練習例のSaaSでは、契約状態Subscriptionと機能を使える権利Entitlementを分けます。解約後も月末まで使える状態や、未契約者への一か月無料付与は、特殊なSubscriptionではなく有効期限を持つEntitlementとして自然に表せます。",
    "文書承認の例では、Documentにapprovedフラグを置くのではなく、Document、Revision、Approvalへ分けます。承認は特定Revisionへの判断なので、編集後のRevisionは承認が無効化されたのではなく一度も承認されておらず、フラグを戻し忘れるバグを構造的に防げます。",
    "非同期処理の例では、実行したい仕事Jobと、一回ごとの試行Executionを分けます。一回目が失敗し二回目が成功しても、Jobに曖昧な単一状態やRetryという特殊状態を持たせず、二つのExecutionの結果として記録できます。",
    "結論として、良い概念設計は未来の自然な仕様を既存構造へ収め、未来のバグを生み得ない形にします。現実世界を無理なく反映する概念、関係者の語彙、変更主体とタイミング、精密な命名へ時間を使うことが、その後のコードの命運を左右します。"
  ],
  "ogp": {
    "image_url": "https://res.cloudinary.com/zenn/image/upload/s--zKBK8tWh--/c_fit%2Cg_north_west%2Cl_text:notosansjp-medium.otf_55:%25E6%25A6%2582%25E5%25BF%25B5%25E8%25A8%25AD%25E8%25A8%2588%25E3%2581%258C%25E3%2580%2581%25E3%2581%259D%25E3%2581%25AE%25E5%25BE%258C%25E3%2581%25AE%25E3%2582%25B3%25E3%2583%25BC%25E3%2583%2589%25E3%2581%25AE%25E5%2591%25BD%25E9%2581%258B%25E3%2582%2592%25E5%25B7%25A6%25E5%258F%25B3%25E3%2581%2599%25E3%2582%258B%2Cw_1010%2Cx_90%2Cy_100/g_south_west%2Cl_text:notosansjp-medium.otf_37:takeshi-teshima%2Cx_203%2Cy_121/g_south_west%2Ch_90%2Cl_fetch:aHR0cHM6Ly9saDMuZ29vZ2xldXNlcmNvbnRlbnQuY29tL2EtL0FGZFp1Y3BsaU5HLTh5aDRSV2hZRmVBamtqQ1QydFNZbFlfTFhvUlVlQ01qQ0E9czk2LWM=%2Cr_max%2Cw_90%2Cx_87%2Cy_95/v1627283836/default/og-base-w1200-v2.png?_a=BACMTiAE",
    "title": "概念設計が、その後のコードの命運を左右する"
  }
}
