{
  "id": "cognitive-debt-skill-placement",
  "url": "https://zenn.dev/pdfractal/articles/c7af0a168c0552",
  "title": "なぜ、ITの職場において低スキル者を排除することが成功のために重要だと誰も言わないのか？",
  "source": "Zenn",
  "genre": "ITマネジメント",
  "technologies": [
    "IT組織",
    "認知負債",
    "人材配置",
    "育成"
  ],
  "reading_minutes": 20,
  "created_at": "2026-08-16",
  "updated_at": "2026-08-16",
  "summary": [
    "記事のいう『排除』は、人格否定や社会・組織からの追放ではなく、要件定義、設計、顧客折衝、品質判断、レビュー承認など認知負荷の高い工程へ、適性を満たさない人を置かないという配置判断です。仕事の難度と人の能力を対応させることが職場づくりの条件だと主張します。",
    "ここでの低スキルは、知識量の少なさや作業速度の遅さそのものではありません。自分の理解と現実のずれを検知できない、指摘を吸収できない、分からない状態を申告できないという自己修正能力の欠如を中心に定義しています。",
    "ITの知的作業は、人数を増やしても成果が単純加算されません。要件の誤解が設計、実装、試験、顧客説明へ連鎖し、周囲に説明・確認・修正・手戻り防止の仕事を追加するため、理解の浅い人の参加が総作業量を増やす場合があります。",
    "記事は、本人の理解不足や判断ミスが、周囲の確認・修正・説明の負担として蓄積する状態を『認知負債』と呼びます。技術的負債が将来の開発速度を落とすように、認知負債は組織全体の判断速度と実行速度を下げます。",
    "問題を決めるのは誤りの数より、誤りが訂正されずに滞留する時間だと説明します。技術力が高くても指摘を拒み属人化や過剰設計を生む人は負債源になり、経験が浅くても誤解を申告し同じミスを減らせる人は育つため、経験年数だけでは判定できません。",
    "将来の損害を予言しなくても、自己修正能力の兆候は日常業務で早期に観測できます。レビュー指摘へ防衛で返すか吸収で返すか、同種の誤りが減るか、質問せず進めるか、不明を申告できるかを記録し、印象や『自分には分かる』という自己申告ではなく外形的な事実で判断します。",
    "育成と重要工程への投入は分けるべきだと述べます。新人や未経験者には、失敗を周囲が回収できる小さな作業、短いフィードバック、理解確認を用意し、自己修正の兆候に応じて段階的に責任を広げます。",
    "同じ観測基準は、育成投資の判断にも使えます。理解が遅くても指摘を吸収して誤りを減らす人は成長できますが、指摘へ防衛的に反応し同じ地点へ戻る人を重要工程で育てようとすると、その損失を顧客、後工程、優秀なメンバーへ移転することになります。",
    "能力の問題が職場で語られにくい理由の一つは、指摘者が冷酷・育成放棄・多様性否定と受け取られる社会的コストです。さらに、配置転換、本人への説明、育成案などの後始末まで指摘者へ返されるため、問題が見える人ほど黙って補完するか、危険な仕事を渡さないか、転職する戦略を選びます。",
    "問題を認めない側にも、自分が外される恐れ、高度な仕事の被害を経験していないこと、自身の理解不足を検知できないことなど複数の理由があると分析します。ただし誰が『見える側』かは自己申告ではなく、指摘への反応と誤りの反復という同じ観測事実で判断すべきだと釘を刺します。",
    "管理者が問題を避けるのは、採用・配置・評価・契約管理の失敗を認めることになるためです。本人の努力や周囲の支援、資料不足へ論点をずらしがちですが、管理者に必要なのは天才的な眼力ではなく、レビュー反応や誤りの反復記録を見て配置判断を先送りしないことだと述べます。",
    "多様性、包摂、心理的安全性、成長機会、チームワークは本来有用でも、職務適性を免除する語彙として使うと現実を隠します。心理的安全性は率直な指摘を可能にする条件であり、低品質を見逃すことではなく、チームワークも一方的な補助を固定化する仕組みではありません。",
    "能力差をすべて仕組みで吸収しようとすると、手順、チェックリスト、会議、承認フローが増え、組織全体が遅くなると警告します。標準化が有効な定型領域と、個人の理解力が決定的な高度領域を分けず、重要工程へ不適合な人を置き続けるための補助輪にすると、優秀な人まで余分な手続きへ縛られます。",
    "『みんなで支える』という美談も、支える側と支えられる側を固定し、負担の所在を見えなくする危険があります。本当の協力は、最低限の理解力・責任感・自己修正能力を前提にし、本人に合う仕事と学習可能な範囲を与え、重要判断を適性のある人へ任せることだと整理します。",
    "認知負債を放置した職場では、誤りを発見できる優秀な人や放置できない真面目な人へ負担が集まり、沈黙・担当範囲の縮小・退職へつながります。低スキル者を重要工程から外さない選択は、一見包摂的でも、結果として優秀な人を職場から押し出すと論じます。",
    "結論は、個人への憎悪ではなく配置責任を引き受けることです。重要工程には自己修正能力を確認できる人を置き、学習中の人には影響範囲を制御した仕事と再評価可能な育成機会を与えることで、品質責任・育成・心理的安全性を本来の意味で両立させます。"
  ],
  "ogp": {
    "image_url": "https://res.cloudinary.com/zenn/image/upload/s--z_gifzo7--/c_fit%2Cg_north_west%2Cl_text:notosansjp-medium.otf_55:%25E3%2581%25AA%25E3%2581%259C%25E3%2580%2581IT%25E3%2581%25AE%25E8%2581%25B7%25E5%25A0%25B4%25E3%2581%25AB%25E3%2581%258A%25E3%2581%2584%25E3%2581%25A6%25E4%25BD%258E%25E3%2582%25B9%25E3%2582%25AD%25E3%2583%25AB%25E8%2580%2585%25E3%2582%2592%25E6%258E%2592%25E9%2599%25A4%25E3%2581%2599%25E3%2582%258B%25E3%2581%2593%25E3%2581%25A8%25E3%2581%258C%25E6%2588%2590%25E5%258A%259F%25E3%2581%25AE%25E3%2581%259F%25E3%2582%2581%25E3%2581%25AB%25E9%2587%258D%25E8%25A6%2581%25E3%2581%25A0%25E3%2581%25A8%25E8%25AA%25B0%25E3%2582%2582%25E8%25A8%2580%25E3%2582%258F%25E3%2581%25AA%25E3%2581%2584%25E3%2581%25AE%25E3%2581%258B%25EF%25BC%259F%2Cw_1010%2Cx_90%2Cy_100/g_south_west%2Cl_text:notosansjp-medium.otf_37:pdfractal%2Cx_203%2Cy_121/g_south_west%2Ch_90%2Cl_fetch:aHR0cHM6Ly9zdGF0aWMuemVubi5zdHVkaW8vdXNlci11cGxvYWQvYXZhdGFyLzRlNDNiMmEyODIuanBlZw==%2Cr_max%2Cw_90%2Cx_87%2Cy_95/v1627283836/default/og-base-w1200-v2.png?_a=BACMTiAE",
    "title": "なぜ、ITの職場において低スキル者を排除することが成功のために重要だと誰も言わないのか？"
  }
}
