{
  "id": "adversarial-verification-ai-review",
  "url": "https://zenn.dev/loglass/articles/6aa18c80496ec6",
  "title": "AIに「レビューして」はもう古い？「敵対的検証」のすすめ",
  "source": "Zenn",
  "genre": "AI駆動開発",
  "technologies": [
    "Claude Code",
    "生成AI",
    "AIエージェント",
    "マルチエージェント",
    "敵対的検証"
  ],
  "reading_minutes": 18,
  "created_at": "2026-08-24",
  "updated_at": "2026-08-24",
  "summary": [
    "記事は、AIへ単に「レビューして」と頼む方法も有効だとしたうえで、より厳密な確認が必要な場面では「敵対的検証して」と指示する方法を提案します。違いは、改善点を列挙するだけでなく、成果物に課題があるという前提で反証を試み、判定と根拠まで返させる点です。",
    "敵対的検証とは、成果物を作った本人とは別の評価者が「間違っているのではないか」という立場から主張や前提を崩しにいく考え方です。レッドチーム、悪魔の代弁者、反証主義と同じく、あえて反対側から検討することで結論の強度を確かめます。",
    "記事によれば、Claude Codeのdeep-researchは重要な主張を複数の検証エージェントに反証させ、code-reviewは検出された指摘を別エージェントが再検証して確信度の低いものを除外します。Anthropicも、作業エージェントとは別のエージェントが基準に照らして出力を検証するAdversarial verificationを推奨パターンとして紹介しています。",
    "効果を支える要素は、成立しない箇所を探しにいく「敵対的な構え」と、成果物を作った推論や会話の流れを引き継がないfresh contextです。独立した文脈の評価者に差分や基準だけを渡すことで、作成時の意図への迎合や自己採点を避けやすくします。",
    "Claude Codeでは成果物ができた後に「敵対的検証して」と頼むところから始められ、対象やサブエージェントの起動を明示しても構いません。ただし筆者の環境にはdeep-researchなどのスキルがあり、サブエージェントが自動で立つか、何体立つかは環境と文脈に依存するため、一言だけで同じ挙動になるという一般化は避けています。",
    "Claude Code以外で成立させる要件は、作成時の文脈から切り離す独立性、反証を試みる役割づけ、事実を一次情報や実データへ接地させること、人間が採否を判断できる出力の4つです。単一チャット型のツールでは新規セッションを開き、経緯や意図を除いた成果物だけを渡し、懐疑的なレビュアーとして検証させます。",
    "提示されたプロンプト雛形は、良い点ではなく成立しない可能性だけを対象とし、事実主張は可能な限り検索や原典で確認し、未確認事項を推測で断定しないよう求めます。各指摘には内容、深刻度、根拠、確度を付け、最後に反証を試みても壊せなかった点を示すことで、成果物の堅い部分と過剰指摘の兆候も確認します。",
    "敵対的レビュアーは健全な成果物にも欠点を見つけようとするため、すべての指摘を受けると過剰設計につながります。一方で、十分に検証せず合格とする手抜きも大きな失敗モードであり、「問題なし」という判定自体も人間が確かめる必要があります。",
    "マルチエージェント構成には、Anthropicの社内テストで同等のシングルエージェント処理の3〜10倍のトークンを使ったというコスト面の制約があります。また同じモデル同士では知識上の盲点を共有し得るため、重要な事実は一次情報へ接地させ、必要ならClaude、Codex、Geminiなど異なるモデル間で検証します。",
    "AIの指摘は正解ではなく判断材料であり、最終的な仕事は人間が指摘を受ける、主張を弱めて受ける、却下するのいずれかを決めることです。判定、根拠、確度を出力させるのは、指摘を鵜呑みにせず、この採否判断を可能にするためです。",
    "筆者はこの記事自体の切り口、構成、調査結果を計8体のスケプティックに検証させ、環境依存の主張を弱める、採否判断を記事の柱へ昇格させる、構成上の指摘を一部だけ受けるなどの選択をしました。事実確認でも、誤った歴史説明や文脈を落とすと過度な一般化になる数値を含む計7件の危うい記述を公開前に修正したとしています。",
    "この手法は、リサーチの裏取り、設計メモ、提案書、ADR、公開前の記事、リリース前のコードなど、もっともらしい成果物を出す前に疑い、やり直しコストを下げたい場面に向きます。まずは一言で試し、常用や仕組み化は失敗時の影響が大きい成果物へ絞るのが現実的です。"
  ],
  "ogp": {
    "image_url": "https://res.cloudinary.com/zenn/image/upload/s---aO5m0K2--/c_fit%2Cg_north_west%2Cl_text:notosansjp-medium.otf_55:AI%25E3%2581%25AB%25E3%2580%258C%25E3%2583%25AC%25E3%2583%2593%25E3%2583%25A5%25E3%2583%25BC%25E3%2581%2597%25E3%2581%25A6%25E3%2580%258D%25E3%2581%25AF%25E3%2582%2582%25E3%2581%2586%25E5%258F%25A4%25E3%2581%2584%25EF%25BC%259F%25E3%2580%258C%25E6%2595%25B5%25E5%25AF%25BE%25E7%259A%2584%25E6%25A4%259C%25E8%25A8%25BC%25E3%2580%258D%25E3%2581%25AE%25E3%2581%2599%25E3%2581%2599%25E3%2582%2581%2Cw_1010%2Cx_90%2Cy_100/g_south_west%2Cl_text:notosansjp-medium.otf_34:little_hands%2528%25E6%259D%25BE%25E5%25B2%25A1%2540Lo...%2Cx_220%2Cy_108/bo_3px_solid_rgb:d6e3ed%2Cg_south_west%2Ch_90%2Cl_fetch:aHR0cHM6Ly9zdGF0aWMuemVubi5zdHVkaW8vdXNlci11cGxvYWQvYXZhdGFyLzRlNWQ4ZTRjZjguanBlZw==%2Cr_20%2Cw_90%2Cx_92%2Cy_102/co_rgb:6e7b85%2Cg_south_west%2Cl_text:notosansjp-medium.otf_30:%25E6%25A0%25AA%25E5%25BC%258F%25E4%25BC%259A%25E7%25A4%25BE%25E3%2583%25AD%25E3%2582%25B0%25E3%2583%25A9%25E3%2582%25B9%2520%25E3%2583%2586%25E3%2583%2583%25E3%2582%25AF%25E3%2583%2596%25E3%2583%25AD%25E3%2582%25B0%2Cx_220%2Cy_160/bo_4px_solid_white%2Cg_south_west%2Ch_50%2Cl_fetch:aHR0cHM6Ly9zdGF0aWMuemVubi5zdHVkaW8vdXNlci11cGxvYWQvYXZhdGFyLzAxNjQwZGFkNjEuanBlZw==%2Cr_max%2Cw_50%2Cx_139%2Cy_84/v1627283836/default/og-base-w1200-v2.png?_a=BACMTiAE",
    "title": "AIに「レビューして」はもう古い？「敵対的検証」のすすめ"
  }
}
