{
  "id": "harness-engineering-design-introduction",
  "url": "https://speakerdeck.com/kinopeee/hanesu-sekkei-nyuumon-kontekisuto-no-tsugi",
  "title": "ハーネス設計入門 〜プロンプト、コンテキストの次〜",
  "source": "Speaker Deck",
  "genre": "AIエージェント開発",
  "technologies": [
    "AIエージェント",
    "ハーネスエンジニアリング",
    "AGENTS.md",
    "Skills",
    "Agent Plugins",
    "MCP"
  ],
  "reading_minutes": 28,
  "created_at": "2026-08-30",
  "updated_at": "2026-08-30",
  "summary": [
    "資料はハーネスエンジニアリングを、モデルの賢さそのものではなく、指示ファイル、ツール、検証、ガードレール、ループなどモデルの外側を設計し、失敗の再発を環境側で防ぐ営みと位置づけます。エージェントが失敗するたびに仕組みを改善し、同じ失敗を起こしにくくする運用までが設計対象です。",
    "ハーネスの定義は、モデル以外のすべてを含めるChase派、失敗を受けて環境を育てるHashimoto派、コンテキスト設計の特殊形としてguidesとsensorsを重視するFowler派、LLMに対するOS層とみなすChawla派、自律・並列・本番規模の故障を解くCodex派の5つに整理されます。ハーネスとコンテキストのどちらを外側とみなすかも流派によって逆転します。",
    "資料によれば、2026年3月以降は構成要素の共通理解、製品実装、標準化によって語彙が収束しました。Agent Plugins 1.0はplugin.json、skills/、mcp.jsonによってSkillsとMCPサーバーを可搬な1形式へまとめますが、署名、審査、権限、シークレット、配布、UXは仕様外またはクライアント側に残り、どこでも同じように動く保証ではありません。",
    "資料は、モデルを変えずハーネスだけを変えたベンチマーク改善や品質変動を効果の根拠として紹介する一方、ハーネスの多くは次世代モデルに吸収される隠れた技術的負債になり得るという反論も扱います。作り込みを目的化せず、中核だけを薄く保ち、モデル更新に合わせて回避策や古い規則を定期的に棚卸しする必要があります。",
    "生成AIは同じ指示でも出力経路が毎回同じとは限らず、長い生成では小さな確率的な揺らぎが積み重なります。そのため、良い指示を書いて成功を期待するだけではなく、逸脱を前提に環境と機械検証で受け止める設計が必要です。",
    "実践の中核は、走り出す前に進路を伝える主観的なハーネス、走った後の逸脱を機械で判定する客観的なガードレール、失敗結果を次の入力に戻して通るまで修正するフィードバックループの3層です。完了条件を、lint、型チェック、ビルド、テストなどの門がすべて通る状態として明示すると、エージェントが自分で失敗に気づき修正できます。",
    "ハーネスの道具は、常時効くルール、タスク単位で認識を合わせるプラン、必要なときだけ読むSkills、役割ごとに独立した文脈へ委任するサブエージェントに分かれます。まずAGENTS.mdのような薄く広い土台を整え、繰り返す手順が見えてからSkillsへ、繰り返す観点が見えてからサブエージェントへ切り出す順序が推奨されます。",
    "AGENTS.mdには、プロジェクト概要、ビルド・テスト・lintのコマンド、プロジェクト固有の規約や構成、変更禁止事項などを、まず50行程度を目安に簡潔かつ検証可能な形で書きます。一般常識、コードを読めば分かる説明、長大な設計書、機械的に確かめられない精神論は常時コンテキストの負担や二重管理になるため避け、模範例を1つ示し、実際の逸脱ごとに1行ずつ育てます。",
    "Skillsは特定作業の完全な手順を必要時だけ読み込む仕組みで、ルールの常時コンテキストを膨らませずに再現性を高めます。サブエージェントは大量調査のオンデマンド委任と、レビューやテスト設計などの事前定義された専門役に使い分けられ、並列化だけでなく親の文脈を汚さないことが本質ですが、同時実行数に応じて時間当たりのトークン消費も増えます。",
    "成果物へのガードレールは、フォーマッタ、リンター、型チェック、ビルド、テストの順に、表記から振る舞いへ検証を深めます。エディタ上の警告だけではエージェントが実行結果を読めないため、すべてをnpm run checkのような1コマンドへ束ね、AGENTS.mdの完了条件とCIの双方で人間とAIに同じ門を通らせます。既存プロジェクトでは、通せる検査から段階的に導入します。",
    "行動へのガードレールは、成果物を事後検証するテスト類とは別に、危険な操作を実行前に止めます。間接プロンプトインジェクション、秘密情報の漏洩、破壊的操作、幻覚パッケージやtyposquattingを含むサプライチェーンを主要リスクとし、許可リスト、確認ゲート、サンドボックス、アクセス制限、審査済みのSkillやPluginという構造で防ぎます。特に、秘密データへのアクセス、不審コンテンツの読み取り、外部送信の3条件を同時に許さないことが重要です。",
    "導入順序は、まずハーネスなしの素の実行を観察して逸脱を記録し、その事実に対応するルールを書くことから始まります。次に検証を1コマンドの門へ束ね、失敗出力を使って門が緑になるまで回すループを閉じ、繰り返しが確認できてからSkillsやサブエージェントを増やします。運用では規則を足すだけでなく、数か月ごとに不要なものを削り、期待した結果を得るために必要な仕組みだけを残します。"
  ],
  "ogp": {
    "image_url": "https://files.speakerdeck.com/presentations/245b6d1c3f9b4311ba13d4f595605e24/slide_0.jpg?40405431",
    "title": "ハーネス設計入門 〜プロンプト、コンテキストの次〜",
    "description": "AirCle＠AIコミュニティ開催の「ハーネス設計入門」で登壇した際に使用したスライド資料です。"
  }
}
