{
  "id": "gpt-5-6-prompt-migration-guide",
  "url": "https://note.com/ai_driven/n/nf5d67f39c468",
  "title": "GPT-5.6公開直後の公式ドキュメントを読み解く——「プロンプト移行ガイド」徹底解説",
  "source": "note",
  "genre": "プロンプト設計",
  "technologies": [
    "GPT-5.6",
    "OpenAI API",
    "Programmatic Tool Calling",
    "プロンプトエンジニアリング"
  ],
  "reading_minutes": 21,
  "created_at": "2026-09-03",
  "updated_at": "2026-09-03",
  "summary": [
    "記事は、OpenAIの「Prompting guidance for GPT-5.6 Sol」を軸に、既存プロンプトをGPT-5.6へ移行する際の判断基準を整理します。主な対象は、ChatGPTやOpenAI APIを業務で使い、システムプロンプトやツール呼び出しの基礎を理解している読者です。",
    "GPT-5.6はSol、Terra、Lunaの3階層で構成され、Solはコーディングや長時間のエージェントタスク、Terraは日常業務、Lunaは高速・低コストの大量処理向けと説明されています。記事は価格やベンチマークも紹介しますが、性能値はOpenAI自身による測定であり、第三者検証ではない点に注意を促します。",
    "移行の第一歩は、既存プロンプトへ指示を足すことではなく、重複したルール、挙動を変えない説明や例、無関係なツールを1グループずつ削り、同じ評価を繰り返すことです。記事が引用するOpenAI社内評価では、軽量化によりスコアが約10〜15%改善し、トークン量が41〜66%、コストが33〜67%減りましたが、効果はワークロードごとに検証する必要があります。",
    "GPT-5.6には細かな手順書より、ユーザーへ届ける成果、成功条件、制約、停止条件を示す依頼書型のプロンプトが向くとされます。「必ず」などの絶対命令は安全性や必須要件だけに使い、検索、質問、継続の判断が分かれる場面では固定手順ではなく判断基準を与えます。",
    "応答の長さはtext.verbosityで基準を設定し、タスク固有の構成だけをプロンプトで指定する役割分担が推奨されています。また、トーンや温かみを決めるPersonalityと、質問、仮定、主体的な行動、トレードオフ説明の方針を決めるCollaborationを分け、抽象的な形容詞ではなく具体的な振る舞いとして定義します。",
    "自律性の境界は依頼の種類に応じて設計します。説明・診断・計画では調査と報告にとどめ、変更・構築・修正ではスコープ内の安全な作業と検証を進め、外部への書き込み、破壊的操作、大幅なスコープ拡張だけ事前確認の対象にします。調査、設計、実装、レビューなど現在の作業段階も区別し、意図しない越境を防ぎます。",
    "ツールはタスクに関係するものだけを渡し、説明には用途、使用条件、重要な戻り値、エラー時の扱いを含めます。独立した読み取りは並列化して行動前に統合し、依存関係がある処理だけ直列化します。Programmatic Tool Callingは、大量データの絞り込み、重複排除、集計を小さなプログラム内で完結させ、モデルへ返す結果を圧縮できる場面に適しています。",
    "Programmatic Tool Callingは、単発の呼び出し、途中結果が次の判断を左右する処理、承認が必要な操作、引用や生成物をそのまま残す処理には向きません。採用する場合は対象範囲、利用可能なツール、出力スキーマ、リトライ上限、直接呼び出しへ戻す条件を具体化し、program_outputと最終messageの両方を検証します。",
    "根拠が必要な回答では、必要な証拠の種類と量、証拠不足時の振る舞いを定義し、見つからないことを存在しないことと混同しません。長時間タスクでは開始時に短い見通しを示し、大きな局面の変化だけを更新します。履歴の圧縮は区切りのよい時点で行い、前提が変わった後まで古い推論を引き継がないようにします。",
    "reasoning effortは以前の設定を基準に1段階低い設定と比較し、lowは速度重視、mediumは起点、highやxhighは評価で改善した場合、maxは最難関タスクに限定する段階的な選び方が示されています。設定を上げる前に、成功条件、依存関係、ツールの振り分け、検証ループがプロンプトから欠けていないか確認します。",
    "フロントエンドや視覚的な成果物では、既存のデザイントークン、コンポーネント、レスポンシブ挙動を保ち、依頼されていない機能や装飾を追加しません。完成前に実際にレンダリングし、崩れ、はみ出し、余白、欠落、一貫性を確認します。コード変更でもテスト、型チェック、lint、ビルドを行い、実行不能ならスモークテストや理由の説明で補います。",
    "推奨プロンプトはRole、Personality、Goal、Success criteria、Constraints、Tools、Output、Stop rulesの8ブロックで構成します。実際の移行では、モデルだけを切り替えて既存評価の基準値を取り、不要な指示やツールを削り、測定された不具合に必要な最小限の指示だけを追加し、変更のたびに同じ評価を再実行します。一度に全面改稿せず、原因を切り分けられる小さな変更を重ねることが結論です。"
  ],
  "ogp": {
    "image_url": "https://assets.st-note.com/production/uploads/images/309147693/rectangle_large_type_2_9158475f7d4d817d3bbccb9ef8930483.png?fit=bounds&quality=85&width=1280",
    "title": "GPT-5.6公開直後の公式ドキュメントを読み解く——「プロンプト移行ガイド」徹底解説｜アイドリ | AI-Driven Lab",
    "description": "本記事の対象    主な対象者：ChatGPTやOpenAI APIを業務で使っており、GPT-5.6への移行でプロンプトをどう見直すか迷っている読者を想定しています。    技術レベル：初級／中級／上級のうち、主に中級を想定しています。    前提知識：システムプロンプトやツール呼び出しといったAPI利用の基礎用語と、ChatGPTやAPI経由でのプロンプト運用の基本操作を理解していることを前提とします。    この記事で得られるもの：GPT-5.6向けにプロンプトのどこを削り、どこを変え、どこは変えなくてよいかを判断できるようになり、自社のプロンプト移行計画を立てる材料を得られます"
  }
}
