{
  "id": "research-agent-auditable-evidence",
  "url": "https://arxiv.org/abs/2608.05235",
  "title": "From Trajectories to Evidence: Auditable Experimental Records for Industrial Research Agents",
  "source": "arXiv",
  "genre": "AIエージェント",
  "technologies": [
    "大規模言語モデル",
    "AIエージェント",
    "推薦システム",
    "GLM-5.2",
    "RankMixer"
  ],
  "reading_minutes": 30,
  "created_at": "2026-08-22",
  "updated_at": "2026-08-22",
  "summary": [
    "産業向け推薦システムを改善する研究エージェントの軌跡には、提案、コード、実行ログ、測定値、失敗、修正が混在するため、実験が完了したことだけでは再利用できる証拠になりません。本論文は、軌跡が実際に何を立証したかを判定する「trajectory-to-evidence conversion」を課題として定式化します。",
    "提案する枠組みは、論文を対象システムへ適応するsource adaptation、複数ラウンドの証拠から主張を選別するclaim qualification、確定した記録を別の対象へ使うdownstream reuseの3段階で構成され、軌跡の最終状態ではなく検証済みの介入単位を保存します。",
    "実行前のgenerate–verify–repairでは、生成器、証拠・制約検証器、下流要件レビュー器を別コンテキストに分離します。候補が利用可能な証拠と矛盾していないか、次工程に必要な情報を欠いていないかを独立に調べ、上限回数内で修復できなければ分岐の停止、検証済み状態へのロールバック、またはエスカレーションを行います。",
    "実験ラウンドの有効性は、介入をコードが忠実に実装したこと、所定の実行が完了したこと、比較プロトコルが正しいこと、元論文の中心的な仕組みを保ったことの4ゲートで判定します。有効な実行でも効果の帰属が不十分なら、永続的な主張ではなく診断情報としてのみ残します。",
    "同じ介入と変更箇所に関する複数ラウンドをまとめ、実行が有効で効果を帰属でき、発動条件と適用境界が明確な改善をRepair、条件付きで再現した失敗をGuard、証拠の矛盾・交絡・不足や未解決の条件がある主張をWithheldに分類します。再利用できる記録になるのはRepairとGuardだけです。",
    "各記録はsource context、intervention、measured outcome、supporting evidence、applicability boundaryの5ブロックを持ち、実装差分、実行状態、評価手順、測定値、帰属確認へ追跡できます。記録群は下流評価前に凍結され、対象側の仕組み・条件・観測に応じてハイブリッド制御器がApply、Defer、Rejectを選びます。",
    "RankMixerの本番実装を共通基準に30本の論文を複数ラウンドで適応したところ、26手法では初回より良い後続ラウンドが見つかった一方、22手法では最終ラウンドが途中の最良結果を下回りました。研究軌跡は非単調に変化するため、終点だけを記憶すると途中で得た有用な知見を失います。",
    "同一のGLM-5.2をコンテキスト分離して検証に使うループは、15件の論文再現バンドルの提案受理率を73.3%から100%へ、コード完全性を92%から97%へ、観測可能性を67%から100%へ改善しましたが、提案との整合性は50%から52%への微増でした。同一モデル由来の相関した見落としや、Method節の網羅率が92.8%、ブロック単位では87.4%に留まる点も示されています。",
    "Amazon Electronicsデータセットで5モデルを自動再現した公開ベンチマークでは、報告論文と再現実験の順位が完全に一致し、Spearmanの順位相関は1.0でした。またFM以外の再現モデルはすべて再現したFMを上回り、パイプラインが論文仕様を実行可能な比較へ変換できることを確認します。",
    "14件の候補クレームを監査した結果、8件がRepair、1件がGuard、5件がWithheldとなり、9件だけが凍結レジストリへ入りました。9件はすべて5ブロック、明示的な発動条件と境界を備え、参照した34個の成果物も保存済みSHA-256と一致しました。",
    "下流の8組の比較では、参照判定がApplyの5件中3件が有益、1件が中立、1件が有害でした。さらに64組で評価した制御器はApplyの適合率が25%、全体精度が67.2%で、クラス不均衡下の常時Reject規則の79.7%を下回っており、肯定的な適用可否判断は依然として主要なボトルネックです。",
    "完全なワークフローから得た2候補は本番A/Bテストで、ライブ配信のページ滞在時間を0.75%、ユーザー成長の純効用を6.34%改善しました。ただしplain-agentやno-memoryとの並行対照がないため枠組み全体への因果帰属はできず、下流比較が8組の単発実行に限られることや制御器評価のクラス不均衡も、一般化に関する主要な制約です。"
  ]
}
