{
  "id": "access-preview",
  "url": "https://example.com/articles/access-preview",
  "title": "Cloudflare Accessで構築する認証付きプレビュー環境",
  "source": "技術ブログ",
  "genre": "セキュリティ",
  "technologies": ["Access", "Zero Trust", "Tunnel"],
  "reading_minutes": 10,
  "created_at": "2026-08-07",
  "updated_at": "2026-08-11",
  "summary": [
    "Cloudflare Tunnelで公開したプレビュー環境の前段にAccessを置き、許可した利用者だけが閲覧できる構成を説明しています。URLを知っているだけでは入れない認証境界を作れます。",
    "メール認証とIDプロバイダー連携の違い、ポリシーの適用範囲、ローカルオリジンを外部へ直接公開しないための設定を順番に確認できます。",
    "一時的なQuick Tunnelと、固定ホスト名を持つNamed Tunnelの用途の違いも整理しています。"
  ],
  "ogp": { "title": "認証境界を設計する", "description": "identity、policy、request、originの関係" }
}
