{
  "id": "cloudflare-workers-rust",
  "url": "https://example.com/articles/cloudflare-workers-rust",
  "title": "Cloudflare WorkersでRustを動かすための実践ガイド",
  "source": "Zenn",
  "genre": "Web開発",
  "technologies": ["Rust", "WebAssembly", "Cloudflare"],
  "reading_minutes": 8,
  "created_at": "2026-08-14",
  "updated_at": "2026-08-15",
  "summary": [
    "Cloudflare Workers上でRustを動かす際の基本構成を、workers-rsとWebAssemblyの役割から整理した記事です。JavaScript中心のWorkers開発と比べて、ビルド成果物やランタイム制約がどこで異なるのかを確認できます。",
    "実装例ではリクエスト処理、環境変数の参照、ローカル実行からデプロイまでを順に扱います。Rustを採用する判断材料と、最初の小さなWorkerを公開するまでの手順を短時間でつかめます。",
    "まず、Cloudflare Workersは常駐サーバーではなく、リクエストなどのイベントに応じてコードを実行する環境だと説明しています。RustのコードはWebAssemblyへコンパイルされ、生成されたJavaScriptの橋渡しコードと一緒に配布されます。",
    "workers-rsはRequestやResponse、環境変数、KVなどのWorkers APIをRustから扱うための型とマクロを提供します。生のWebAssembly連携を自分で組む範囲を減らし、通常のRustアプリケーションに近い形でハンドラーを書けます。",
    "プロジェクト作成時にはRustツールチェーンに加えて、wasm32-unknown-unknownターゲットとWranglerが必要です。ツールのバージョンを固定すると、ローカルとCIで生成物がずれる問題を減らせます。",
    "エントリーポイントではfetchイベントを受け取り、非同期関数からResponseを返します。非同期処理はJavaScriptのPromiseへ変換されるため、通常のスレッド型サーバーと同じ前提で設計しないことが重要です。",
    "Workersの実行環境には一般的なOSのファイルシステムや任意のTCPソケットがありません。そのため、利用したいcrateがブラウザ向けWebAssemblyでも動くか、WorkersのAPIで置き換えられるかを事前に確認します。",
    "依存crateを増やすほどWebAssemblyのサイズと起動時間へ影響が出ます。機能の小さなWorkerでは、標準ライブラリと少数の依存関係に絞る方が運用しやすいと述べています。",
    "設定値はソースコードへ埋め込まず、Wranglerのvarsやsecretから受け取ります。公開リポジトリでは秘密値を含むファイルを除外し、CIでもGitHub Secretsから渡す境界を保ちます。",
    "ローカル開発ではWranglerを使い、本番と同じWorkersランタイムに近い環境でリクエストを確認します。通常のRust単体テストと、Workers上の入出力を確認する統合テストを分けると問題の所在を追いやすくなります。",
    "エラーは利用者向けのHTTPレスポンスと運用者向けのログを分離します。内部の詳細や秘密値をレスポンスへ含めず、ログには記事IDなど追跡に必要な情報だけを構造化して残します。",
    "外部APIを呼ぶ場合はタイムアウトと応答サイズの上限を設けます。失敗時に無制限に再試行すると実行時間と費用が増えるため、再試行回数と対象エラーを限定します。",
    "大きなレスポンスはすべてメモリへ読み込まず、可能ならストリームとして扱います。Workersにはメモリ上限があるため、入力サイズを信頼しない設計が必要です。",
    "モジュールのトップレベルには不変の設定や再利用可能なクライアントだけを置きます。リクエスト固有の値をグローバル変数へ保存すると、別の呼び出しに状態が漏れる可能性があります。",
    "デプロイ前にはcargo testだけでなく、リリースビルドとWranglerのdry-runを実行します。コンパイルできることとWorkersへ正しく梱包できることは別の確認項目です。",
    "生成されたWebAssemblyが大きい場合はLTO、strip、codegen-unitsなどのリリース設定を見直します。ただし、最初から細かな最適化へ進むのではなく、計測結果を基に依存関係から整理します。",
    "Cloudflareのバインディングを使える処理は、外部REST APIを経由せずWorker内のバインディングから呼びます。認証情報や余分なネットワーク往復を減らせるためです。",
    "Rustを採用する価値は、既存のRust資産、厳密な型、CPU中心の処理がある場合に高くなります。一方、小さなルーティング中心のAPIではTypeScriptの方が開発とデプロイを単純にできる場合があります。",
    "本サイトの構成では、この比較から配信WorkerにHonoとTypeScriptを選び、Rustは記事データの検証とOGP取得へ利用しています。両方を使うこと自体を目的にせず、それぞれが適する境界へ置いています。",
    "記事データの生成はデプロイより前に完了させます。Workerのリクエスト処理中に記事本文やOGPを取得しないため、外部サイトの遅延や障害が閲覧画面へ波及しません。",
    "Gitへ保存する生成物は同じ入力から同じ内容になるように並び順を固定します。時刻だけが毎回変わるフィールドを避けることで、不要な差分とレビュー負荷を減らせます。",
    "CIではRustテスト、Clippy、TypeScriptテスト、型検査、フロントエンドビルド、Wrangler dry-runを順に実行します。どの層で失敗したかを明確にし、壊れた記事データの公開を防ぎます。",
    "デプロイ権限は必要最小限のCloudflare API TokenとしてGitHub Secretsへ設定します。フォーク直後は秘密情報がなくてもCIの検証部分だけを利用できるようにします。",
    "運用開始後はWorkersとworkers-rsの互換性日付、依存crate、Wranglerを定期的に更新します。更新時は一度にすべてを変えず、生成物と実行時の差分を確認できる単位に分けます。",
    "最終的な判断として、RustはCloudflare Workersで実行可能ですが、すべての処理をRustへ寄せる必要はありません。配信、ローカル処理、データ正本の責務を分けることが、フォーク可能な小規模サイトでは最も扱いやすい構成です。"
  ],
  "ogp": {
    "title": "エッジで動かすRust",
    "description": "workerからwasm、buildからdeployまでを整理"
  }
}
