{
  "id": "oauth-attacks-and-security-bcp",
  "url": "https://zenn.dev/hidebike712/books/oauth-attacks-and-bcp",
  "title": "攻撃手法から学ぶ OAuth セキュリティベストプラクティス",
  "source": "Zenn",
  "genre": "OAuthセキュリティ",
  "technologies": [
    "OAuth 2.0",
    "OpenID Connect",
    "RFC 9700",
    "PKCE",
    "DPoP",
    "mTLS",
    "JWT"
  ],
  "reading_minutes": 176,
  "created_at": "2026-08-17",
  "updated_at": "2026-08-17",
  "summary": [
    "本書はRFC 9700（OAuth 2.0 Security Best Current Practice、BCP 240）を中心に、複数の仕様へ分散し継続的に変化するOAuthの脅威と対策を、攻撃手法から逆引きできる形へ整理しています。2026年8月17日時点の代表的な10攻撃を対象とし、OAuth 2.0とOpenID Connectの基本フローや各トークンの役割は既知であること、掲載シーケンスは商用実装を簡略化したものであることを前提としています。",
    "リダイレクトURIの不十分な検証では、ワイルドカードがスラッシュを含む任意文字列として解釈される例や、クエリを許すパターンとオープンリダイレクター、HTTPリダイレクト時のフラグメント再付与を組み合わせる例により、認可コードやインプリシットフローのアクセストークンが攻撃者へ渡ります。原則的な対策は、登録値とredirect_uriをRFC 3986の単純な文字列比較で完全一致させることで、ネイティブアプリのループバックURIにはRFC 8252に基づく例外処理が必要です。",
    "認可コードインジェクションでは、攻撃者が自身の正規フローで得たstateを残したまま認可コードだけを被害者のものへ置換すると、state検証を通過し、正規のコンフィデンシャルクライアントが被害者用トークンを取得して攻撃者セッションへ保存してしまいます。stateはリクエストとセッションの対応を守っても、認可コードと認可リクエストの対応までは証明しない点が重要です。",
    "認可コードインジェクションの第一の対策はPKCEで、被害者の認可コードに結び付いたcode_challengeと攻撃者セッションのcode_verifierが一致しないため、認可サーバーがトークン交換を拒否します。OpenID Connectでは、トークンエンドポイントから取得したIDトークンのnonceをセッション値と照合し、検証完了までトークンを使わない方法もありますが、認可レスポンス側の別のIDトークンだけを検証してはならず、認可コードを直接交換できるパブリッククライアントにはnonceだけでは対処できません。",
    "アクセストークンインジェクションでは、インプリシットフローを開始した攻撃者が、自身の認可レスポンスのアクセストークンだけを窃取済みの被害者トークンへ置換します。stateは攻撃者自身の正規値なので検知できず、SPAがトークンでプロフィールを取得してユーザーを特定すると、攻撃者が被害者としてログインできてしまいます。第一の対策はアクセストークンを認可エンドポイントから発行するフローをやめ、PKCE付き認可コードフローへ移行することです。",
    "OpenID Connectでresponse_type=id_token tokenを使う場合は、IDトークンのat_hashと提示されたアクセストークンの対応を検証すれば、アクセストークンだけの置換を検知できます。攻撃者がIDトークンも被害者のものへ置換すると、今度はIDトークン内のnonceと攻撃者セッションのnonceが一致しません。ただし、これらはクライアントへの注入を防ぐ対策であり、漏洩アクセストークンがリソースサーバーで直接使われることまでは防げません。",
    "OAuthのCSRFでは、攻撃者が自身の認可コードを付けた正規クライアントのリダイレクトURIを被害者に開かせ、攻撃者用アクセストークンを被害者セッションへ結び付けます。その後、被害者がアップロードしたファイルなどが攻撃者側のリソースへ保存されます。認可リクエストとセッションを一回限りのstateで結ぶ方法、トークンエンドポイント発行のIDトークン内nonceを照合する方法、認可コードに結び付くcode_challengeと被害者セッションのcode_verifierの不一致を認可サーバーが検出するPKCEが、それぞれ対策になります。",
    "漏洩アクセストークンの不正使用では、複数のリソースサーバーで使えるトークンを偽のリソースサーバーへ送らせ、攻撃者がそれを正規サーバーで再利用するフィッシング例を扱います。RFC 9700は送信者制限と受信者制限の併用を推奨しており、トークン自体が正当であるという検証だけでなく、提示者と利用先の双方を固定する必要があります。",
    "mTLSによる送信者制限では、トークン取得時のX.509クライアント証明書のthumbprintをcnf.x5t#S256へ埋め込み、リソースサーバーが現在のmTLS接続の証明書と照合します。DPoPではクライアントの公開鍵thumbprintをcnf.jktへ結び付け、リクエストごとに秘密鍵署名されたDPoP proof JWTを提示し、proofの公開鍵、HTTPメソッドとURI、アクセストークンのハッシュであるathを検証します。opaqueトークンでは通常、認可サーバーのイントロスペクション結果を使って同等の情報を確認します。",
    "受信者制限では、クライアントがresourceパラメーターやscopeで利用先を伝え、認可サーバーがアクセストークンのaudなどへ反映し、リソースサーバーが自身を受信者として含むか検証します。URLの代わりにリソースサーバー証明書のthumbprintを使えば別CAから得た証明書によるなりすまし検知やURL秘匿にも役立ちます。受信者制限はクライアントの暗号処理が少ない一方でサーバーごとにトークンが必要になり、mTLSなどの送信者制限は暗号処理が必要な一方で一つのトークンを複数サーバーに使えるというトレードオフがあります。",
    "IDトークンリプレイアタックでは、OpenID Connectのインプリシットフローを使うSPAが必須のnonceを送信・検証しない場合、攻撃者が自身の正規stateを残してIDトークンを被害者のものへ置換し、署名や通常のクレーム検証を通過して被害者としてログインします。認可リクエストごとのnonceをセッションに保存し、返却IDトークンのnonceクレームと照合すれば、過去の別フローで発行されたIDトークンを拒否できます。",
    "Mix-Upアタックでは、同じリダイレクトURIで複数の認可サーバーを扱うクライアントに対し、悪意ある認可サーバーが正規認可サーバーへユーザーを転送します。クライアントはセッション上では悪意ある認可サーバーを選択したまま正規サーバーの認可コードを受け取り、そのコードを悪意あるサーバーのトークンエンドポイントへ送って漏洩させます。認可開始時の発行者識別子と、RFC 9207のissレスポンスパラメーターまたはIDトークンのissを単純比較することが有効です。",
    "認可サーバーごとに異なるリダイレクトURIを使うMix-Up対策も紹介されますが、正規認可サーバーへ悪意あるクライアントを登録し、攻撃対象クライアントの別サーバー用URIをそのリダイレクト先に指定できる場合は突破されます。このため、発行者識別子を検証できるなら、リダイレクトURIの分離だけに依存する方法は推奨されません。",
    "クライアントによるリソースオーナーのなりすましは、JWTアクセストークンのsubが、ユーザー関与フローではリソースオーナー、client_credentialsではクライアントを表し得ることを悪用します。攻撃者が被害者のユーザーIDと同じclient_idを登録でき、リソースサーバーがトークン発行コンテキストを区別しない場合、クライアント用subをユーザー用subと誤認して被害者リソースを返します。client_idを認可サーバー側で割り当てる、専用プレフィックスなどで名前空間を分ける、または両種のトークンを区別できる情報を提供する必要があります。",
    "DPoP proofリプレイアタックでは、アクセストークンと正当なproofを窃取した攻撃者が、proofのhtmとhtuが示す同じHTTPメソッド・エンドポイントで、受入可能期間内に再利用します。サーバーはiatまたはサーバー供給nonceから作成時刻を決定し、理想的には数秒から数分の短期間だけ受け入れる必要があります。nonceならクライアントとのクロックスキューを避けられ、認可サーバー供給とリソースサーバー供給の方式があります。",
    "さらにDPoP proofのjtiを対象URIごとに有効期間中保存し、同じ値の再出現を拒否すれば強いリプレイ防御になります。ただし、複数バックエンド間で状態を共有するにはRedisなどを使ったリアルタイム同期が必要になり得るため、実運用上のコストがあります。要件によっては、proofのリプレイ問題を持たないmTLSの証明書拘束へ移行する選択肢も示されています。",
    "DPoP proofの事前生成では、正規端末を操作できる内部者などが、その端末の秘密鍵で将来時刻のiatを持つproofを作り、対応するアクセストークンとともに別端末へ持ち出して、指定時刻に利用します。短命なサーバー供給DPoP nonceをproofへ必須化すれば持ち出した時点から利用時までに失効させられ、アクセストークン自体を短命にすればathで結び付いたproofもトークン失効後には使えません。",
    "最終章は10攻撃を、攻撃概要、主な被害、対抗策、関連仕様の一覧として再整理しています。全体を通じた設計原則は、リダイレクト先・認可要求・コード・トークン・ユーザーセッション・発行者・提示鍵・利用先の対応関係をそれぞれ明示的に結び付け、署名が正しい、stateが一致する、トークンが有効といった単独の検証だけで安全と判断しないことです。"
  ],
  "ogp": {
    "image_url": "https://res.cloudinary.com/zenn/image/upload/s--O1H4ck-k--/g_center%2Ch_280%2Cl_fetch:aHR0cHM6Ly9zdGF0aWMuemVubi5zdHVkaW8vdXNlci11cGxvYWQvYm9va19jb3Zlci9kNDY5ODNmOTEwLnBuZw==%2Cw_200/v1627283836/default/og-base-book_yz4z02.jpg?_a=BACMTiAE",
    "title": "攻撃手法から学ぶ OAuth セキュリティベストプラクティス",
    "description": "OAuth における代表的な攻撃手法とその対抗策を最新のベストプラクティスに基づいて解説します。"
  }
}
